{
  "source": {
    "id": "golden-1",
    "base_study_id": "golden-base-1",
    "label": "Golden synthetic paper",
    "origin": "upload",
    "text_sha256": "de4a9224b9cbd73d6c570458b7e8aa1dc63d5303cfc9850128d433b4ba5aba22",
    "schema_versions": {
      "paper_parse": "0.6.0",
      "extraction": "0.5.0"
    }
  },
  "text": "Twenty patients and eighteen controls performed a Stroop task during fMRI. Patients were 34.2 years old on average. Images were acquired on a 3T scanner.",
  "parsed_paper": {
    "header": {
      "artifact_kind": "parsed_paper",
      "schema_version": "x",
      "article_id": "x",
      "identifiers": {
        "pmid": "12345678"
      },
      "producer": {
        "name": "x",
        "version": "x"
      }
    },
    "source": "pmc",
    "text_path": "x",
    "text_sha256": "x",
    "bibliography": {
      "title": "A paper"
    },
    "is_meta_analysis": false
  },
  "coordinate_parse": {
    "header": {
      "artifact_kind": "coordinate_parse",
      "schema_version": "0.6.0",
      "article_id": "art-12345678",
      "identifiers": {
        "pmid": "12345678"
      },
      "producer": {
        "name": "ingestion",
        "version": "1.0.0",
        "stage": "analyses"
      }
    },
    "parse_id": "0c9b14c251c250a6b5ff055566dece6664bbcd74774657b17367eea22b748149",
    "text_sha256": "0000000000000000000000000000000000000000000000000000000000000000",
    "analyses": [
      {
        "origin": "table",
        "table_id": "t1",
        "cells": [
          {
            "row": 1,
            "column_group": 0
          }
        ],
        "name": "patients > controls",
        "coordinate_space": "MNI",
        "role": "result",
        "points": [
          {
            "coordinates": [
              10,
              20,
              30
            ],
            "space": null,
            "values": [
              {
                "kind": "t",
                "value": 3.5
              }
            ]
          }
        ],
        "key": "analysis#12d544dad3a9b2df"
      },
      {
        "origin": "table",
        "table_id": "t1",
        "cells": [
          {
            "row": 2,
            "column_group": 0
          }
        ],
        "name": "controls > patients",
        "coordinate_space": "MNI",
        "role": "result",
        "points": [
          {
            "coordinates": [
              -4,
              2,
              8
            ],
            "space": null,
            "values": [
              {
                "kind": "t",
                "value": -3.5
              }
            ]
          }
        ],
        "key": "analysis#77745f9962a07fc0"
      },
      {
        "origin": "table",
        "table_id": "t2",
        "cells": [
          {
            "row": 1,
            "column_group": 0
          }
        ],
        "name": "seed",
        "coordinate_space": "MNI",
        "role": "anchor",
        "points": [
          {
            "coordinates": [
              0,
              0,
              0
            ],
            "space": null,
            "values": [
              {
                "kind": "t",
                "value": 3.5
              }
            ]
          }
        ],
        "key": "analysis#25dc160a851819c3"
      }
    ]
  },
  "record": {
    "extraction_metadata": {
      "extractor_model": "gpt-6.1-sol",
      "extractor_version": "1.0.0"
    },
    "local_id": "study-1",
    "analyses": [
      {
        "local_id": "an_1",
        "name": {
          "value": "patients > controls",
          "extraction_status": "extracted",
          "evidence": {
            "status": "not_found"
          }
        },
        "definition": {
          "extraction_status": "not_reported",
          "evidence": {
            "status": "not_applicable"
          }
        },
        "prespecification": {
          "extraction_status": "not_reported",
          "evidence": {
            "status": "not_applicable"
          }
        },
        "spatial_scope": {
          "extraction_status": "not_reported",
          "evidence": {
            "status": "not_applicable"
          }
        },
        "measure": "msr_1",
        "groups": [
          {
            "group": "grp_a",
            "n": {
              "value": 20,
              "extraction_status": "extracted",
              "evidence": {
                "status": "not_found"
              }
            }
          }
        ],
        "effect": {
          "cells": [
            {
              "term": "trm_1",
              "level": {
                "value": "patients",
                "extraction_status": "extracted",
                "evidence": {
                  "status": "not_found"
                }
              },
              "direction": {
                "value": "positive",
                "extraction_status": "extracted",
                "evidence": {
                  "status": "not_found"
                }
              }
            }
          ],
          "statistic": {
            "family": {
              "extraction_status": "not_reported",
              "evidence": {
                "status": "not_applicable"
              }
            }
          }
        },
        "details": {
          "details_type": "MassUnivariateDetails"
        },
        "model_estimation": "mdl_1",
        "tasks": [
          "tsk_1"
        ],
        "acquisitions": [
          "acq_1"
        ]
      }
    ],
    "groups": [
      {
        "local_id": "grp_a",
        "name": {
          "value": "patients",
          "extraction_status": "extracted",
          "evidence": {
            "status": "not_found"
          }
        },
        "species": {
          "extraction_status": "not_reported",
          "evidence": {
            "status": "not_applicable"
          }
        },
        "age_mean": {
          "extraction_status": "extracted",
          "value": 34.2,
          "value_source": "reported",
          "evidence": {
            "status": "present",
            "sets": [
              {
                "source": "model_quote",
                "spans": [
                  {
                    "start_char": 75,
                    "end_char": 115,
                    "text": "Patients were 34.2 years old on average."
                  }
                ]
              }
            ]
          }
        }
      },
      {
        "local_id": "grp_b",
        "name": {
          "value": "controls",
          "extraction_status": "extracted",
          "evidence": {
            "status": "not_found"
          }
        },
        "species": {
          "extraction_status": "not_reported",
          "evidence": {
            "status": "not_applicable"
          }
        },
        "age_mean": {
          "extraction_status": "not_reported",
          "unreported_reason": "ambiguous",
          "evidence": {
            "status": "not_applicable"
          }
        }
      }
    ],
    "tasks": [
      {
        "local_id": "tsk_1",
        "name": {
          "value": "Stroop",
          "extraction_status": "extracted",
          "evidence": {
            "status": "not_found"
          }
        },
        "conditions": [
          {
            "local_id": "cnd_1",
            "name": {
              "extraction_status": "not_reported",
              "evidence": {
                "status": "not_applicable"
              }
            }
          },
          {
            "local_id": "cnd_2",
            "name": {
              "extraction_status": "not_reported",
              "evidence": {
                "status": "not_applicable"
              }
            }
          }
        ]
      }
    ],
    "assessments": [
      {
        "local_id": "asm_1",
        "name": {
          "extraction_status": "not_reported",
          "evidence": {
            "status": "not_applicable"
          }
        }
      }
    ],
    "regions": [
      {
        "local_id": "reg_1",
        "name": {
          "extraction_status": "not_reported",
          "evidence": {
            "status": "not_applicable"
          }
        },
        "definition_method": {
          "extraction_status": "not_reported",
          "evidence": {
            "status": "not_applicable"
          }
        }
      }
    ],
    "devices": [
      {
        "local_id": "dev_1"
      }
    ],
    "acquisitions": [
      {
        "local_id": "acq_1",
        "acquisition_type": "MRI",
        "modality": {
          "extraction_status": "not_reported",
          "evidence": {
            "status": "not_applicable"
          }
        },
        "device": "dev_1"
      }
    ],
    "model_estimations": [
      {
        "local_id": "mdl_1",
        "model_family": {
          "extraction_status": "not_reported",
          "evidence": {
            "status": "not_applicable"
          }
        },
        "model_type": {
          "extraction_status": "not_reported",
          "evidence": {
            "status": "not_applicable"
          }
        },
        "stage": {
          "extraction_status": "not_reported",
          "evidence": {
            "status": "not_applicable"
          }
        },
        "terms": [
          {
            "local_id": "trm_1",
            "name": {
              "extraction_status": "not_reported",
              "evidence": {
                "status": "not_applicable"
              }
            },
            "type": {
              "extraction_status": "not_reported",
              "evidence": {
                "status": "not_applicable"
              }
            }
          }
        ]
      }
    ],
    "measures": [
      {
        "local_id": "msr_1",
        "family": {
          "extraction_status": "not_reported",
          "evidence": {
            "status": "not_applicable"
          }
        },
        "type": {
          "extraction_status": "not_reported",
          "evidence": {